id,content,named_entities,channel
13236090,"GOOD NEWS OF THE WEEK (SUNDAY MAY 23rd - PART 1)  Every Sunday and Wednesday we will bring you “Good News of the Week.” With all the news that is out there and the fake news media continuing to share propaganda and lies, we want to make sure you understand WE ARE WINNING ON MANY FRONTS. All of this happened the past 4 days!  1. Walt Disney/ABC acknowledging the “hard impact” the disastrous broadcast has had on the company. Disney made its first public comments about the ratings fiasco. https://www.breitbart.com/entertainment/2021/05/19/disney-feels-hard-impact-of-disastrous-oscars-ratings-as-abc-faces-advertiser-uncertainty/  2. CDC's second-in-command Anne Schuchat is stepping down https://www.politico.com/news/2021/05/17/cdc-schuchat-steps-down-489077  3. UK Begins Ripping Out Chinese Communist Party-Linked Huawei From 5G Network https://thenationalpulse.com/breaking/uk-rips-out-huawei-technology/  4. BREAKING Utah Senate, on a 23-5 vote, just passed a bill banning mask mandates for all schools. Iowa does the same.   5. Texas Governor Signs Heartbeat Bill Protecting Unborn Children From ‘Ravages Of Abortion’https://thefederalist.com/2021/05/20/texas-governor-signs-heartbeat-bill-protecting-unborn-children-from-ravages-of-abortion/  6. House Intel Republicans Drop Bombshell Report, Claim Fauci Helped Fund Dangerous Research in China. CDC director admits Coronavirus ""lab based origin"" is a possibility, they must investigate thoroughly. https://trendingpolitics.com/house-intel-republicans-drop-bombshell-report-claim-fauci-funded-dangerous-research-in-china-crugg/  7. Biden administration closes two ICE facilities after allegations of abuse https://www.usatoday.com/story/news/politics/2021/05/20/dhs-closes-ice-facilities-georgia-massachusetts-after-reports-abuse/5182341001/  8. 150+ MISSING CHILDREN FOUND IN NORTH CAROLINA OPERATION https://breaking911.com/150-missing-children-found-in-north-carolina-operation/ 9. Biden: US to resupply Israel's Iron Dome defense system.  https://news.yahoo.com/president-biden-replenish-israel-iron-221200083.html  10. Henry McMaster Signs Bill to Make South Carolina 46th Open Carry State https://www.breitbart.com/2nd-amendment/2021/05/20/henry-mcmaster-south-carolina-open-carry/  11. Judge Orders Audit of 145,000 Absentee Ballots in Fulton County, Georgia https://www.breitbart.com/politics/2021/05/22/judge-orders-audit-145000-absentee-ballots-fulton-county-georgia/   12. Nolte: Disgraced CNN‘s Ratings Fall Off a Cliff https://www.breitbart.com/the-media/2021/05/21/nolte-disgraced-cnns-ratings-fall-off-cliff/   13. President Trump is eyeing rallies in June and July in Florida, Georgia, Ohio and North Carolina 🇺🇸🇺🇸🇺🇸🇺🇸  14. Georgia Judge Calls for Forensic Audit of Fulton County Ballots After Large Discrepancies Found in Ballot Batches https://www.thegatewaypundit.com/2021/05/breaking-georgia-judge-calls-forensic-audit-fulton-county-ballots-large-discrepancies-21-found-ballot-batches/  15. Pennsylvania Voters Strip Dem Governor Tom Wolf Of Dictatorial Powers https://trendingpolitics.com/pennsylvania-voters-strip-dem-governor-tom-wolf-of-dictatorial-powers/  16. Epstein’s Cell Guards Admit To ‘Falsifying Records,’ Cut Deal To Avoid Jail https://nationalfile.com/breaking-epsteins-cell-guards-admit-to-falsifying-records-cut-deal-to-avoid-jail/  17. President Trump will be the keynote speaker at the NC GOP State Convention June 5th. https://convention.nc.gop/  18. Hundreds of protesters say Mayor Lori Lightfoot 'failed Chicago' at demonstration organized by BLM and teachers union outside her home https://www.theblaze.com/news/lori-lightfoot-protest-blm-chicago Chicago Police Union Issues Vote of No Confidence in Anti-White Racist Mayor Lori Lightfoot https://[www.thegatewaypundit.com/2021/05/chicago-police-union-issues-vote-no-confidence-anti-white-racist-mayor-lori-lightfoot-video/ (conti](https://www.thegatewaypundit.com/2021/05/chicago-police-union-issues-vote-no-confidence-anti-white-racist-mayor-lori-lightfoot-video/) nued)👇👇","[{u'text': u'MAY 23rd', u'type': u'DATE'}, {u'text': u'1', u'type': u'CARDINAL'}, {u'text': u'Sunday', u'type': u'DATE'}, {u'text': u'Wednesday', u'type': u'DATE'}, {u'text': u'Good News of the Week', u'type': u'WORK_OF_ART'}, {u'text': u'the past 4 days', u'type': u'DATE'}, {u'text': u'1', u'type': u'CARDINAL'}, {u'text': u'Walt Disney', u'type': u'ORG'}, {u'text': u'ABC', u'type': u'ORG'}, {u'text': u'Disney', u'type': u'ORG'}, {u'text': u'first', u'type': u'ORDINAL'}, {u'text': u'2', u'type': u'CARDINAL'}, {u'text': u'CDC', u'type': u'ORG'}, {u'text': u'second', u'type': u'ORDINAL'}, {u'text': u'Anne Schuchat', u'type': u'PERSON'}, {u'text': u'3', u'type': u'CARDINAL'}, {u'text': u'5', u'type': u'CARDINAL'}, {u'text': u'4', u'type': u'CARDINAL'}, {u'text': u'BREAKING Utah Senate', u'type': u'ORG'}, {u'text': u'23', u'type': u'CARDINAL'}, {u'text': u'Iowa', u'type': u'GPE'}, {u'text': u'5', u'type': u'CARDINAL'}, {u'text': u'Texas', u'type': u'GPE'}, {u'text': u'Signs Heartbeat Bill Protecting Unborn', u'type': u'PERSON'}, {u'text': u'texas', u'type': u'GPE'}, {u'text': u'6', u'type': u'CARDINAL'}, {u'text': u'House', u'type': u'ORG'}, {u'text': u'Intel', u'type': u'ORG'}, {u'text': u'Republicans', u'type': u'NORP'}, {u'text': u'Drop Bombshell Report', u'type': u'ORG'}, {u'text': u'China', u'type': u'GPE'}, {u'text': u'CDC', u'type': u'ORG'}, {u'text': u'Coronavirus', u'type': u'ORG'}, {u'text': u'https://trendingpolitics.com/house-intel-republicans-drop-bombshell-report-claim-fauci-funded-dangerous-research-in-china-crugg/nn7', u'type': u'ORG'}, {u'text': u'Biden', u'type': u'PERSON'}, {u'text': u'two', u'type': u'CARDINAL'}, {u'text': u'ICE', u'type': u'ORG'}, {u'text': u'https://www.usatoday.com/story/news/politics/2021/05/20/dhs-closes-ice-facilities-georgia-massachusetts-after-reports-abuse/5182341001/', u'type': u'ORG'}, {u'text': u'8', u'type': u'CARDINAL'}, {u'text': u'9', u'type': u'CARDINAL'}, {u'text': u'Biden', u'type': u'ORG'}, {u'text': u'US', u'type': u'GPE'}, {u'text': u'Israel', u'type': u'GPE'}, {u'text': u'Iron Dome', u'type': u'ORG'}, {u'text': u'10', u'type': u'CARDINAL'}, {u'text': u'Henry McMaster', u'type': u'PERSON'}, {u'text': u'11', u'type': u'CARDINAL'}, {u'text': u'Orders Audit', u'type': u'PERSON'}, {u'text': u'145,000', u'type': u'CARDINAL'}, {u'text': u'Fulton County', u'type': u'GPE'}, {u'text': u'Georgia', u'type': u'GPE'}, {u'text': u'12', u'type': u'CARDINAL'}, {u'text': u'13', u'type': u'CARDINAL'}, {u'text': u'Trump', u'type': u'PERSON'}, {u'text': u'June', u'type': u'DATE'}, {u'text': u'July', u'type': u'DATE'}, {u'text': u'Florida', u'type': u'GPE'}, {u'text': u'Georgia', u'type': u'GPE'}, {u'text': u'Ohio', u'type': u'GPE'}, {u'text': u'North Carolina', u'type': u'GPE'}, {u'text': u'U0001f1f8U0001f1faU0001f1f8U0001f1faU0001f1f8U0001f1faU0001f1f8nn14', u'type': u'PERCENT'}, {u'text': u'Georgia', u'type': u'GPE'}, {u'text': u'Fulton County', u'type': u'GPE'}, {u'text': u'Ballot Batches https://www.thegatewaypundit.com/2021/05/breaking-georgia-judge-calls-forensic-audit-fulton-county-ballots-large-discrepancies-21-found-ballot-batches/', u'type': u'ORG'}, {u'text': u'15', u'type': u'CARDINAL'}, {u'text': u'Pennsylvania Voters Strip', u'type': u'ORG'}, {u'text': u'Dem', u'type': u'NORP'}, {u'text': u'Tom Wolf', u'type': u'PERSON'}, {u'text': u'16', u'type': u'CARDINAL'}, {u'text': u'Jail https://nationalfile.com/breaking-epsteins-cell-guards-admit-to-falsifying-records-cut-deal-to-avoid-jail/', u'type': u'PERSON'}, {u'text': u'17', u'type': u'CARDINAL'}, {u'text': u'Trump', u'type': u'PERSON'}, {u'text': u'the NC GOP State Convention', u'type': u'ORG'}, {u'text': u'June 5th', u'type': u'DATE'}, {u'text': u'18', u'type': u'CARDINAL'}, {u'text': u'Hundreds', u'type': u'CARDINAL'}, {u'text': u'Lori Lightfoot', u'type': u'PERSON'}, {u'text': u'Chicago', u'type': u'GPE'}, {u'text': u'BLM', u'type': u'ORG'}, {u'text': u'Chicago Police Union Issues Vote of No Confidence', u'type': u'ORG'}, {u'text': u'Lori Lightfoot', u'type': u'PERSON'}, {u'text': u'chicago', u'type': u'GPE'}, {u'text': u'conti](https://www.thegatewaypundit.com/2021/05/chicago-police-union', u'type': u'ORG'}]",685
13242305,"GD's C4 systems Land Warrior Project https://www.army-technology.com/projects/land_warrior/ Also, 5G was used in military applications for communications in the 80s. Land Warrior and Mounted Warrior soldier systems The US Army began operational assessment of the Land Warrior and Mounted Warrior systems in May 2006 with the 4th Stryker Brigade Combat Team (SBCT) at Fort Lewis, Washington. 440 Land Warrior systems and 147 Mounted Warrior systems were used in the assessment. The assessment concluded in September 2006 and was followed by limited user test.","[{u'text': u'5', u'type': u'CARDINAL'}, {u'text': u'the 80s', u'type': u'DATE'}, {u'text': u'The US Army', u'type': u'ORG'}, {u'text': u'May 2006', u'type': u'DATE'}, {u'text': u'4th', u'type': u'ORDINAL'}, {u'text': u'Combat Team', u'type': u'ORG'}, {u'text': u'Fort Lewis', u'type': u'GPE'}, {u'text': u'Washington', u'type': u'GPE'}, {u'text': u'440', u'type': u'CARDINAL'}, {u'text': u'147', u'type': u'CARDINAL'}, {u'text': u'September 2006', u'type': u'DATE'}]",4040
13266252,"WHAT DO YOU GUYS THINK? 🤔  ""Mark Steele says the reason why we are seeing magnets attracted to the people who've received the Jab is because the nanotechnology is forming an internal antenna array designed to be connected to the 5G internet of things. Steele believes that the Jab-Victims who are not magnetic received a placebo (which would make sense as a double-blind placebo trial is a standard scientific research method).  When 5G is turned on, Jab-Victims will be able to be located and targeted specifically because they are now essentially a walking Wi-Fi antenna....""  https://melbrake.wordpress.com/2020/04/26/microsofts-new-mark-of-the-beast-technology-is-patent-060606-renegade-tribune/  Source: https://www.bitchute.com/video/p3mqgtKEKpTx/","[{u'text': u'Mark Steele', u'type': u'PERSON'}, {u'text': u'5', u'type': u'CARDINAL'}, {u'text': u'5', u'type': u'CARDINAL'}]",698
13266809,"GOOD NEWS OF THE WEEK (SUNDAY MAY 23rd - PART 1)  Every Sunday and Wednesday we will bring you “Good News of the Week.” With all the news that is out there and the fake news media continuing to share propaganda and lies, we want to make sure you understand WE ARE WINNING ON MANY FRONTS. All of this happened the past 4 days!  1. Walt Disney/ABC acknowledging the “hard impact” the disastrous broadcast has had on the company. Disney made its first public comments about the ratings fiasco. https://www.breitbart.com/entertainment/2021/05/19/disney-feels-hard-impact-of-disastrous-oscars-ratings-as-abc-faces-advertiser-uncertainty/  2. CDC's second-in-command Anne Schuchat is stepping down https://www.politico.com/news/2021/05/17/cdc-schuchat-steps-down-489077  3. UK Begins Ripping Out Chinese Communist Party-Linked Huawei From 5G Network https://thenationalpulse.com/breaking/uk-rips-out-huawei-technology/  4. BREAKING Utah Senate, on a 23-5 vote, just passed a bill banning mask mandates for all schools. Iowa does the same.   5. Texas Governor Signs Heartbeat Bill Protecting Unborn Children From ‘Ravages Of Abortion’https://thefederalist.com/2021/05/20/texas-governor-signs-heartbeat-bill-protecting-unborn-children-from-ravages-of-abortion/  6. House Intel Republicans Drop Bombshell Report, Claim Fauci Helped Fund Dangerous Research in China. CDC director admits Coronavirus ""lab based origin"" is a possibility, they must investigate thoroughly. https://trendingpolitics.com/house-intel-republicans-drop-bombshell-report-claim-fauci-funded-dangerous-research-in-china-crugg/  7. Biden administration closes two ICE facilities after allegations of abuse https://www.usatoday.com/story/news/politics/2021/05/20/dhs-closes-ice-facilities-georgia-massachusetts-after-reports-abuse/5182341001/  8. 150+ MISSING CHILDREN FOUND IN NORTH CAROLINA OPERATION https://breaking911.com/150-missing-children-found-in-north-carolina-operation/ 9. Biden: US to resupply Israel's Iron Dome defense system.  https://news.yahoo.com/president-biden-replenish-israel-iron-221200083.html  10. Henry McMaster Signs Bill to Make South Carolina 46th Open Carry State https://www.breitbart.com/2nd-amendment/2021/05/20/henry-mcmaster-south-carolina-open-carry/  11. Judge Orders Audit of 145,000 Absentee Ballots in Fulton County, Georgia https://www.breitbart.com/politics/2021/05/22/judge-orders-audit-145000-absentee-ballots-fulton-county-georgia/   12. Nolte: Disgraced CNN‘s Ratings Fall Off a Cliff https://www.breitbart.com/the-media/2021/05/21/nolte-disgraced-cnns-ratings-fall-off-cliff/   13. President Trump is eyeing rallies in June and July in Florida, Georgia, Ohio and North Carolina 🇺🇸🇺🇸🇺🇸🇺🇸  14. Georgia Judge Calls for Forensic Audit of Fulton County Ballots After Large Discrepancies Found in Ballot Batches https://www.thegatewaypundit.com/2021/05/breaking-georgia-judge-calls-forensic-audit-fulton-county-ballots-large-discrepancies-21-found-ballot-batches/  15. Pennsylvania Voters Strip Dem Governor Tom Wolf Of Dictatorial Powers https://trendingpolitics.com/pennsylvania-voters-strip-dem-governor-tom-wolf-of-dictatorial-powers/  16. Epstein’s Cell Guards Admit To ‘Falsifying Records,’ Cut Deal To Avoid Jail https://nationalfile.com/breaking-epsteins-cell-guards-admit-to-falsifying-records-cut-deal-to-avoid-jail/  17. President Trump will be the keynote speaker at the NC GOP State Convention June 5th. https://convention.nc.gop/  18. Hundreds of protesters say Mayor Lori Lightfoot 'failed Chicago' at demonstration organized by BLM and teachers union outside her home https://www.theblaze.com/news/lori-lightfoot-protest-blm-chicago Chicago Police Union Issues Vote of No Confidence in Anti-White Racist Mayor Lori Lightfoot https://[www.thegatewaypundit.com/2021/05/chicago-police-union-issues-vote-no-confidence-anti-white-racist-mayor-lori-lightfoot-video/ (conti](https://www.thegatewaypundit.com/2021/05/chicago-police-union-issues-vote-no-confidence-anti-white-racist-mayor-lori-lightfoot-video/) nued)👇👇","[{u'text': u'MAY 23rd', u'type': u'DATE'}, {u'text': u'1', u'type': u'CARDINAL'}, {u'text': u'Sunday', u'type': u'DATE'}, {u'text': u'Wednesday', u'type': u'DATE'}, {u'text': u'Good News of the Week', u'type': u'WORK_OF_ART'}, {u'text': u'the past 4 days', u'type': u'DATE'}, {u'text': u'1', u'type': u'CARDINAL'}, {u'text': u'Walt Disney', u'type': u'ORG'}, {u'text': u'ABC', u'type': u'ORG'}, {u'text': u'Disney', u'type': u'ORG'}, {u'text': u'first', u'type': u'ORDINAL'}, {u'text': u'2', u'type': u'CARDINAL'}, {u'text': u'CDC', u'type': u'ORG'}, {u'text': u'second', u'type': u'ORDINAL'}, {u'text': u'Anne Schuchat', u'type': u'PERSON'}, {u'text': u'3', u'type': u'CARDINAL'}, {u'text': u'5', u'type': u'CARDINAL'}, {u'text': u'4', u'type': u'CARDINAL'}, {u'text': u'BREAKING Utah Senate', u'type': u'ORG'}, {u'text': u'23', u'type': u'CARDINAL'}, {u'text': u'Iowa', u'type': u'GPE'}, {u'text': u'5', u'type': u'CARDINAL'}, {u'text': u'Texas', u'type': u'GPE'}, {u'text': u'Signs Heartbeat Bill Protecting Unborn', u'type': u'PERSON'}, {u'text': u'texas', u'type': u'GPE'}, {u'text': u'6', u'type': u'CARDINAL'}, {u'text': u'House', u'type': u'ORG'}, {u'text': u'Intel', u'type': u'ORG'}, {u'text': u'Republicans', u'type': u'NORP'}, {u'text': u'Drop Bombshell Report', u'type': u'ORG'}, {u'text': u'China', u'type': u'GPE'}, {u'text': u'CDC', u'type': u'ORG'}, {u'text': u'Coronavirus', u'type': u'ORG'}, {u'text': u'https://trendingpolitics.com/house-intel-republicans-drop-bombshell-report-claim-fauci-funded-dangerous-research-in-china-crugg/nn7', u'type': u'ORG'}, {u'text': u'Biden', u'type': u'PERSON'}, {u'text': u'two', u'type': u'CARDINAL'}, {u'text': u'ICE', u'type': u'ORG'}, {u'text': u'https://www.usatoday.com/story/news/politics/2021/05/20/dhs-closes-ice-facilities-georgia-massachusetts-after-reports-abuse/5182341001/', u'type': u'ORG'}, {u'text': u'8', u'type': u'CARDINAL'}, {u'text': u'9', u'type': u'CARDINAL'}, {u'text': u'Biden', u'type': u'ORG'}, {u'text': u'US', u'type': u'GPE'}, {u'text': u'Israel', u'type': u'GPE'}, {u'text': u'Iron Dome', u'type': u'ORG'}, {u'text': u'10', u'type': u'CARDINAL'}, {u'text': u'Henry McMaster', u'type': u'PERSON'}, {u'text': u'11', u'type': u'CARDINAL'}, {u'text': u'Orders Audit', u'type': u'PERSON'}, {u'text': u'145,000', u'type': u'CARDINAL'}, {u'text': u'Fulton County', u'type': u'GPE'}, {u'text': u'Georgia', u'type': u'GPE'}, {u'text': u'12', u'type': u'CARDINAL'}, {u'text': u'13', u'type': u'CARDINAL'}, {u'text': u'Trump', u'type': u'PERSON'}, {u'text': u'June', u'type': u'DATE'}, {u'text': u'July', u'type': u'DATE'}, {u'text': u'Florida', u'type': u'GPE'}, {u'text': u'Georgia', u'type': u'GPE'}, {u'text': u'Ohio', u'type': u'GPE'}, {u'text': u'North Carolina', u'type': u'GPE'}, {u'text': u'U0001f1f8U0001f1faU0001f1f8U0001f1faU0001f1f8U0001f1faU0001f1f8nn14', u'type': u'PERCENT'}, {u'text': u'Georgia', u'type': u'GPE'}, {u'text': u'Fulton County', u'type': u'GPE'}, {u'text': u'Ballot Batches https://www.thegatewaypundit.com/2021/05/breaking-georgia-judge-calls-forensic-audit-fulton-county-ballots-large-discrepancies-21-found-ballot-batches/', u'type': u'ORG'}, {u'text': u'15', u'type': u'CARDINAL'}, {u'text': u'Pennsylvania Voters Strip', u'type': u'ORG'}, {u'text': u'Dem', u'type': u'NORP'}, {u'text': u'Tom Wolf', u'type': u'PERSON'}, {u'text': u'16', u'type': u'CARDINAL'}, {u'text': u'Jail https://nationalfile.com/breaking-epsteins-cell-guards-admit-to-falsifying-records-cut-deal-to-avoid-jail/', u'type': u'PERSON'}, {u'text': u'17', u'type': u'CARDINAL'}, {u'text': u'Trump', u'type': u'PERSON'}, {u'text': u'the NC GOP State Convention', u'type': u'ORG'}, {u'text': u'June 5th', u'type': u'DATE'}, {u'text': u'18', u'type': u'CARDINAL'}, {u'text': u'Hundreds', u'type': u'CARDINAL'}, {u'text': u'Lori Lightfoot', u'type': u'PERSON'}, {u'text': u'Chicago', u'type': u'GPE'}, {u'text': u'BLM', u'type': u'ORG'}, {u'text': u'Chicago Police Union Issues Vote of No Confidence', u'type': u'ORG'}, {u'text': u'Lori Lightfoot', u'type': u'PERSON'}, {u'text': u'chicago', u'type': u'GPE'}, {u'text': u'conti](https://www.thegatewaypundit.com/2021/05/chicago-police-union', u'type': u'ORG'}]",15004
13268755,Vaccinated People are being Tracked using 5G Towers https://rumble.com/vhk9wr-vaccinated-people-are-being-tracked-using-5g-towers.html,"[{u'text': u'5', u'type': u'CARDINAL'}]",690
13279437,"""Mark Steele says the reason why we are seeing magnets attracted to the people who've received the Jab is because the   Nanotechnology is forming an internal antenna array designed to be connected to the 5G internet of things.   Steele believes that the Jab-Victims who are not magnetic received a placebo (which would make sense as a double-blind placebo trial is a standard scientific research method).  When 5G is turned on, Jab-Victims will be able to be located and targeted specifically because they are now essentially a walking Wi-Fi antenna....""","[{u'text': u'Mark Steele', u'type': u'PERSON'}, {u'text': u'5', u'type': u'CARDINAL'}, {u'text': u'5', u'type': u'CARDINAL'}]",401
13289130,"PLEASE SHARE: a lawsuit against 5G was filed in early may, to the high court of israel, demanding to stop the 5G-smart cities-iot deployment!  for interviews on the matter please contact shai - shai@ahava528.com  the lawsuit in hebrew - https://emfkeepers.co.il/wp-content/uploads/2021/05/נוסח-סופי-4-לעתירה.pdf  response of the high court - https://emfkeepers.co.il/wp-content/uploads/2021/05/החלטת-בגץ.pdf","[{u'text': u'5', u'type': u'CARDINAL'}, {u'text': u'israel', u'type': u'GPE'}, {u'text': u'5G', u'type': u'CARDINAL'}]",688
13292838,"[​​](https://telegra.ph/file/22ea3029eeebe4cd74667.jpg)🇲🇪 ‼️Testing of 5G technology began in Montenegro.   5G technology will find the widest application in automation and control of industrial processes, medicine, utilities, agriculture and automotive industry. Telenor and the Faculty of Electrical Engineering signed a Memorandum of Cooperation to mark the commissioning of a 5G test environment. 👉 @insider_amigo 💥👍 According to the PR center, they stated that the Memorandum aims to strengthen and improve the IT sector in Montenegro and aims to enhance synergy between the academic and business sectors, joint development of 5G technology, scholarships for promising ETF teachers and many others. Joint activities.5G technology will find the widest application in automation and control of industrial processes, medicine, utilities, agriculture and the automotive industry. 🔰We r[emind you that starting from 2022-2023, all countries will start switching to 5G frequencies. This will lead to an outbreak of a pandemic, or rather side effects for those who make the vaccine. https](https://t.me/insider_amigo/1017)                                 ://t.me/insider_amigo 👆👆👆💥Click to subscribe... Channel is a bomb 👍","[{u'text': u'u200bu200b](https://telegra.ph', u'type': u'ORG'}, {u'text': u'u203cufe0fTesting', u'type': u'CARDINAL'}, {u'text': u'5', u'type': u'CARDINAL'}, {u'text': u'Montenegro', u'type': u'GPE'}, {u'text': u'5', u'type': u'CARDINAL'}, {u'text': u'the Faculty of Electrical Engineering', u'type': u'ORG'}, {u'text': u'a Memorandum of Cooperation', u'type': u'WORK_OF_ART'}, {u'text': u'5', u'type': u'CARDINAL'}, {u'text': u'@insider_amigo', u'type': u'ORG'}, {u'text': u'U0001f4a5', u'type': u'ORG'}, {u'text': u'Memorandum', u'type': u'ORG'}, {u'text': u'Montenegro', u'type': u'GPE'}, {u'text': u'5', u'type': u'CARDINAL'}, {u'text': u'2022-2023', u'type': u'DATE'}, {u'text': u'5', u'type': u'CARDINAL'}, {u'text': u'U0001f4a5Click', u'type': u'ORG'}, {u'text': u'Channel', u'type': u'ORG'}]",698
13341096,Pfizer device found via blootooth under the skin of this man:  HBPC-J43 Join the discussions join the protests at our 12000 members telegram group: https://t.me/nocovidvaccines Protect yourself from 5G and Wifi radiations from inside the vaccines as well: https://dq271.isrefer.com/go/AultHome/AUL651/ Get vaccine and mask exemptions written by an MD send us a mail at thetruthjungle@protonmail.com,"[{u'text': u'12000', u'type': u'CARDINAL'}, {u'text': u'5', u'type': u'CARDINAL'}, {u'text': u'Wifi', u'type': u'PERSON'}, {u'text': u'https://dq271.isrefer.com/go/AultHome/AUL651/', u'type': u'CARDINAL'}, {u'text': u'MD', u'type': u'GPE'}]",688
13343559,"Past proves the Future, The Future proves the past   Alert: Suspicious 5G activity by JPMorgan Chase Bank Global Data Center (Columbus, Ohio) during the COVID-19 lockdown – Patriots for Truth https://patriots4truth.org/2020/04/29/alert-suspicious-5g-activity-by-jpmorgan-chase-bank/","[{u'text': u'Alert', u'type': u'PERSON'}, {u'text': u'JPMorgan Chase Bank Global Data Center', u'type': u'ORG'}, {u'text': u'Columbus', u'type': u'GPE'}, {u'text': u'Ohio', u'type': u'GPE'}, {u'text': u'https://patriots4truth.org/2020/04/29/alert-suspicious-5g-activity-by-jpmorgan-chase-bank/', u'type': u'PERSON'}]",690
13343696,Ok we are scoping 5Gs right now. They are out of control. Passed 3 in mid phase of being constructed within only .5 miles  Also noticed these are on Brownish polls,"[{u'text': u'5Gs', u'type': u'CARDINAL'}, {u'text': u'3', u'type': u'CARDINAL'}, {u'text': u'only .5 miles', u'type': u'QUANTITY'}, {u'text': u'Brownish', u'type': u'NORP'}]",690
13355776,Credit to OP Cindy G.  Scouting 5G locations so we can map them and figure out how this is going to go down  East Orange NJ and also route 24,"[{u'text': u'Cindy G.nnScouting', u'type': u'PERSON'}, {u'text': u'5', u'type': u'CARDINAL'}, {u'text': u'24', u'type': u'CARDINAL'}]",690
13360842,The vaxxed are getting guns for jabs in one state.  The 5G controls emotions in the vaxxed 5G also affects the health and mood of the unvaxxed   Intel: Deep state planning mass casualty event with the 2nd amendment and blaming anti-vaxxed  The infection connection 💉📡 🧠 🔫   Hope not,"[{u'text': u'one', u'type': u'CARDINAL'}, {u'text': u'5', u'type': u'CARDINAL'}, {u'text': u'Intel', u'type': u'ORG'}]",690
13366011,"📲 According to this phone repairman, there is currently no such thing as a '5G phone'...yet. For now, it seems like a marketing scam. The government is using the 5G towers for something else. Have you read about O[peration Sleeping Beauty?](https://t.me/westcoastintel/9751)    Decades ago, Dr. Rauscher’s research group in San Leandro, California played with the effects of several different frequencies. (Along the lines of[Persinger's researc](https://t.me/westcoastintel/9752)  h)  One of her frequencies she called the 'marijuana frequency'. ""It gets us all laughing.”  “Give me the money and three months,” Rauscher swears, “and I’ll be able to affect the behavior of eighty percent of the people in this town without their knowing it. Make them happy — or at least they’ll think they're happy. Or aggressive.”","[{u'text': u'5', u'type': u'CARDINAL'}, {u'text': u'Decades ago', u'type': u'DATE'}, {u'text': u'Rauscher', u'type': u'PERSON'}, {u'text': u'San Leandro', u'type': u'GPE'}, {u'text': u'California', u'type': u'GPE'}, {u'text': u'researc](https://t.me/westcoastintel/9752)  h', u'type': u'ORG'}, {u'text': u'One', u'type': u'CARDINAL'}, {u'text': u'three months', u'type': u'DATE'}, {u'text': u'Rauscher', u'type': u'ORG'}, {u'text': u'eighty percent', u'type': u'PERCENT'}]",4040
