id,content,named_entities,channel
50559658,"This was the lying deceptive e-mail sent to me this morning!   Occasionally we'll send sponsored content so that we can continue to provide The Horn News as a free service to you. Please find an important message below, sponsored by Michael Robinson.   The Horn News Dear Reader,  The American economy is about to go through a projected $1.4 trillion transformation over the next couple years...  All thanks to the shift to 5G that's been years in the making.  It's finally hitting the mainstream this year thanks to some of the largest, most profitable corporations in America.  And as this new technology makes its way across the country...  It's going to change every aspect of our day-to-day lives. The way we work... learn... socialize... communicate... and entertain ourselves....  Every industry – and every company – will be impacted.  But the truth is, it's too late to invest directly in 5G. That ship has sailed.  Instead, I've uncovered 20 tiny companies that belong to entirely different sectors of the market...  Yet, thanks to this new technological shift, each could see 1,000% gains within eight months .  I'm going to break it all down for you here .  I'll tell you how 5G is going to change the American landscape...  Why this ""backdoor"" route is anyone's best bet to exploit 5G...  And how it could help these 20 stocks turn $1,000 each into a $250,000 windfall by the end of 2021 .  See you there,   Michael Robinson  Director of Technology and Venture Capital Research, Money Morning","[{u'text': u'this morning', u'type': u'TIME'}, {u'text': u'The Horn News', u'type': u'ORG'}, {u'text': u'Michael Robinson', u'type': u'PERSON'}, {u'text': u'Horn NewsnDear Reader', u'type': u'ORG'}, {u'text': u'American', u'type': u'NORP'}, {u'text': u'$1.4 trillion', u'type': u'MONEY'}, {u'text': u'the next couple years', u'type': u'DATE'}, {u'text': u'5', u'type': u'CARDINAL'}, {u'text': u'years', u'type': u'DATE'}, {u'text': u'this year', u'type': u'DATE'}, {u'text': u'America', u'type': u'GPE'}, {u'text': u'20', u'type': u'CARDINAL'}, {u'text': u'1,000%', u'type': u'PERCENT'}, {u'text': u'eight monthsn', u'type': u'DATE'}, {u'text': u'American', u'type': u'NORP'}, {u'text': u'5', u'type': u'CARDINAL'}, {u'text': u'20', u'type': u'CARDINAL'}, {u'text': u'1,000', u'type': u'MONEY'}, {u'text': u'250,000', u'type': u'MONEY'}, {u'text': u'the end of 2021', u'type': u'DATE'}, {u'text': u'Michael Robinson', u'type': u'PERSON'}, {u'text': u'Venture Capital Research', u'type': u'ORG'}, {u'text': u'Money Morning', u'type': u'WORK_OF_ART'}]",58485
50586878,The vaxxed are getting guns for jabs in one state.  The 5G controls emotions in the vaxxed 5G also affects the health and mood of the unvaxxed   Intel: Deep state planning mass casualty event with the 2nd amendment and blaming anti-vaxxed  The infection connection 💉📡 🧠 🔫   Hope not,"[{u'text': u'one', u'type': u'CARDINAL'}, {u'text': u'5', u'type': u'CARDINAL'}, {u'text': u'Intel', u'type': u'ORG'}]",58485
50611075,Jabs for guns area West Virginia  💥💥💥💥💥💥   2A Sanctuary State as of last month  North Carolina Ohio   I am seeing a connection here   5G Towers - Deep State Planning a 2A event with mass casualties and to blame anti-vaxxed?,"[{u'text': u'West Virginia', u'type': u'GPE'}, {u'text': u'U0001f4a5', u'type': u'ORG'}, {u'text': u'U0001f4a5', u'type': u'ORG'}, {u'text': u'U0001f4a5', u'type': u'ORG'}, {u'text': u'U0001f4a5', u'type': u'ORG'}, {u'text': u'U0001f4a5', u'type': u'ORG'}, {u'text': u'last month', u'type': u'DATE'}, {u'text': u'North Carolina', u'type': u'GPE'}, {u'text': u'Ohio', u'type': u'GPE'}, {u'text': u'2A', u'type': u'CARDINAL'}]",58485
50624195,Interesting  📲 No such thing as a 5G phone according to this phone repairman. It’s a scam. The governments are using the 5G towers for something else.,"[{u'text': u'5', u'type': u'CARDINAL'}, {u'text': u'5', u'type': u'CARDINAL'}]",11865
50642131,Jabs for guns area West Virginia  💥💥💥💥💥💥   2A Sanctuary State as of last month  North Carolina Ohio   I am seeing a connection here   5G Towers - Deep State Planning a 2A event with mass casualties and to blame anti-vaxxed?,"[{u'text': u'West Virginia', u'type': u'GPE'}, {u'text': u'U0001f4a5', u'type': u'ORG'}, {u'text': u'U0001f4a5', u'type': u'ORG'}, {u'text': u'U0001f4a5', u'type': u'ORG'}, {u'text': u'U0001f4a5', u'type': u'ORG'}, {u'text': u'U0001f4a5', u'type': u'ORG'}, {u'text': u'last month', u'type': u'DATE'}, {u'text': u'North Carolina', u'type': u'GPE'}, {u'text': u'Ohio', u'type': u'GPE'}, {u'text': u'2A', u'type': u'CARDINAL'}]",58485
50650931,🇺🇲🇺🇲🇺🇲🇺🇲🇺🇲  There was some confusion with our normally scheduled meeting.  Due to the emergency meeting called by votes the other day and the in-depth information we were talking about as well as the mapping we created just early this morning..  The vaxx getting guns for jabs - West Virginia The vaxx controlled by 5G   The Unvaccinated resistant areas sorrounding West Virginia  North Carolina Ohio  With 2A sanctuary states  Collection more info as it comes in  Something is disturbing about this   We are gearing up to make next Thursdays Meeting for 8PM Eastern bringing this information to you as we continue to gather data...  The 3 letter agency whistleblower also attending this next meeting  Can you make a shield of protection to block frequencies  Getting ready as there is a storm coming  Attentive:  Fire department Captian - Smoke inhalation protection   Intel:  Small data leaking as to a deception of what is really inside our phones  Is it really 5G chips? Or something else that we have been paying extra for?  More to come,"[{u'text': u'U0001f1fa', u'type': u'GPE'}, {u'text': u'U0001f1fa', u'type': u'GPE'}, {u'text': u'U0001f1fa', u'type': u'GPE'}, {u'text': u'U0001f1fa', u'type': u'GPE'}, {u'text': u'U0001f1fa', u'type': u'GPE'}, {u'text': u'just early this morning', u'type': u'TIME'}, {u'text': u'West Virginia', u'type': u'GPE'}, {u'text': u'5', u'type': u'CARDINAL'}, {u'text': u'West Virginia', u'type': u'GPE'}, {u'text': u'North Carolina', u'type': u'GPE'}, {u'text': u'Ohio', u'type': u'GPE'}, {u'text': u'2A', u'type': u'CARDINAL'}, {u'text': u'8PM', u'type': u'CARDINAL'}, {u'text': u'Eastern', u'type': u'ORG'}, {u'text': u'3', u'type': u'CARDINAL'}, {u'text': u'Captian', u'type': u'NORP'}, {u'text': u'Intel', u'type': u'ORG'}, {u'text': u'5', u'type': u'CARDINAL'}]",58485
50660811,VAXXTERMINATION TIME COMING SOON - THOSE 5G INCINERATORS ARE GOING TO LIGHT THOSE INJECTED ANTENNAS UP - BE THE RESISTANCE WWW.SAVEUSNOW.ORG.UK,[],11865
50830341,"@MIKAYOUTUBERS  ⚠️GERMANIA 1/06/'21. CODICE MORSE, PROJECT BLUE  BEAM, 3° GUERRA MONDIALE  TRAMITE 5G/6G?","[{u'text': u""ufe0fGERMANIA 1/06/'21"", u'type': u'PRODUCT'}, {u'text': u'MORSE', u'type': u'ORG'}, {u'text': u'PROJECT BLUE nBEAM', u'type': u'ORG'}, {u'text': u'3', u'type': u'CARDINAL'}, {u'text': u'GUERRA MONDIALE  TRAMITE', u'type': u'ORG'}]",56044
50881787,"Trump imposed a plan to remove China's ""5G"" from our towers.  We know that there are health and Mental concerns with ""5G"" but could he have labeled it replacing our ""5G"" with something that isn't what Creates a health and mental issue?  Could this also be why we're seeing them being changed and an alarming rate and could this actually have taken affect where they are removing China 5G and replacing it with a system that is safe? ""5G"" being replaced with a 4G system that was rebranded?   This could stop the frequencies with a nanobots in the Vaccinated from being controlled by the so called 5G along with Space Force     https://www.cnet.com/news/trumps-crazy-5g-plan-diagnoses-real-problem-cybersecurity-threat/","[{u'text': u'Trump', u'type': u'ORG'}, {u'text': u'China', u'type': u'GPE'}, {u'text': u'5', u'type': u'CARDINAL'}, {u'text': u'5', u'type': u'CARDINAL'}, {u'text': u'5', u'type': u'CARDINAL'}, {u'text': u'China', u'type': u'GPE'}, {u'text': u'5', u'type': u'CARDINAL'}, {u'text': u'4', u'type': u'CARDINAL'}, {u'text': u'5', u'type': u'CARDINAL'}, {u'text': u'Space Forcennnnn', u'type': u'ORG'}]",58485
50893487,"Pres Trump  ordered the CCP 5G removed from our cell towers soon after he took office. When local govts were using Chinese drones to spy on their citizens defying lockdowns, he ordered that all use of these were illegal due to their ability to transmit data to CCP.","[{u'text': u'CCP', u'type': u'ORG'}, {u'text': u'Chinese', u'type': u'NORP'}, {u'text': u'CCP', u'type': u'ORG'}]",58485
50893660,I was following Chinese citizens & CCTV videos on Twitter showing the effects of the CCP 5G in Dec- Jan 2020. It was horrid.,"[{u'text': u'Chinese', u'type': u'NORP'}, {u'text': u'& CCTV', u'type': u'GPE'}, {u'text': u'Twitter', u'type': u'PRODUCT'}, {u'text': u'CCP', u'type': u'ORG'}, {u'text': u'Jan 2020', u'type': u'DATE'}]",58485
51068005,🛑14  Intel:  The Vaccinated are going to be restricted from Flying. At 30K feet they can have a blood clot  The Vaccine ID cards is to let Deep State know who they can control and inslave.  There isn't a virus at all that was released from Wuhan. Wuhan was creating the Bio Weapon Vaccine. 5G and Contaminated Test Swabs created flu like symptoms,"[{u'text': u'14', u'type': u'CARDINAL'}, {u'text': u'Intel', u'type': u'ORG'}, {u'text': u'Flying', u'type': u'ORG'}, {u'text': u'30K feet', u'type': u'QUANTITY'}, {u'text': u'Vaccine', u'type': u'PERSON'}, {u'text': u'Wuhan', u'type': u'GPE'}, {u'text': u'Wuhan', u'type': u'GPE'}, {u'text': u'the Bio Weapon Vaccine', u'type': u'ORG'}, {u'text': u'5', u'type': u'CARDINAL'}]",58485
51241912,"While truthers were hyper focussed on 5G, Amazon have slipped this spy network into a surveillance grid. Only needs one device up to every 800m for the net to operate. And it is designed to track and spy on on everyone. Not just those with Amazon devices. Rob Braxton explains https://youtu.be/ccrUAp4GQvY","[{u'text': u'5', u'type': u'CARDINAL'}, {u'text': u'Amazon', u'type': u'ORG'}, {u'text': u'one', u'type': u'CARDINAL'}, {u'text': u'Amazon', u'type': u'ORG'}, {u'text': u'Rob Braxton', u'type': u'PERSON'}]",58485
51257159,"Phone sticks to baby because of the covid vaccine. Protect yourself from Emfs and read the science behind it, click here for more info: https://dq271.isrefer.com/go/HOUSEUSB/AUL1691/  Join our telegram group, 16000 members all against NWO, vaccines, 5G and so forth: https://t.me/nocovidvaccines","[{u'text': u'Emfs', u'type': u'PERSON'}, {u'text': u'16000', u'type': u'CARDINAL'}, {u'text': u'NWO', u'type': u'ORG'}, {u'text': u'5', u'type': u'CARDINAL'}]",135783
51302136,"Seriously though, we are facing this every day. Tear down the 5Gs","[{u'text': u'5Gs', u'type': u'CARDINAL'}]",58485
51379185,"We covered the reason behind 5G, and the 5G towers being torn down. It wasn't Covid activation, it was Chinese equipment.  https://t.me/AzazelMain/202583","[{u'text': u'5', u'type': u'CARDINAL'}, {u'text': u'5', u'type': u'CARDINAL'}, {u'text': u'Chinese', u'type': u'NORP'}]",36003
51698059,"EMF measuring device shows a significant increase near a nurse who has been vaccinated with covid 19. There is no reason for this ammount of EMF to be present inside a human, except if they are becoming a beacon and receiver for the new 5G tech. This EMF pollution does damage so if you stay too much near vaccinated people you will be EMF affected. Tumor promotion by exposure to radiofrequency electromagnetic fields below exposure limits for humans” is a replication study that used very, very low RF exposures and combined the RF with a known carcinogen. Researchers found elevated lymphoma and significantly higher numbers of tumors in the lungs and livers in the animals exposed to both RF and the carcinogen, leading researchers to state that previous research was confirmed and that “our results show that electromagnetic fields obviously enhance the growth of tumors” . There are ways to protect against 5G and Wifi exposure. More info here: https://dq271.isrefer.com/go/FAMILY/AUL862/","[{u'text': u'EMF', u'type': u'ORG'}, {u'text': u'19', u'type': u'CARDINAL'}, {u'text': u'EMF', u'type': u'ORG'}, {u'text': u'5', u'type': u'CARDINAL'}, {u'text': u'EMF', u'type': u'ORG'}, {u'text': u'RF', u'type': u'ORG'}, {u'text': u'RF', u'type': u'ORG'}, {u'text': u'RF', u'type': u'ORG'}, {u'text': u'5', u'type': u'CARDINAL'}, {u'text': u'Wifi', u'type': u'PERSON'}]",135783
51716828,"How do you protect yourself from 5G and harmful radiation? Did you know that the Aulterra company fought with the system because it came up with real solutions against harmful radiation? Here's a very effective way to protect yourself from 5G and the harmful radiation emitted by everyday devices. Aulterra products neutralize these harmful radiations. On their website you can find scientific studies that certify that they work! Even so, more and more people who have used these products say that they have got rid of the headaches and in the house there is a more relaxing environment. I also use a whole house protection usb which I am very happy with. It helped me get rid of insomnia. I'll leave a link below to see what it's all about. ""They can't take us down"" - the new slogan Aulterra. Link here: Take care and god bless you all 🙏  https://dq271.isrefer.com/go/store/AUL862/","[{u'text': u'5', u'type': u'CARDINAL'}, {u'text': u'Aulterra', u'type': u'GPE'}, {u'text': u'5', u'type': u'CARDINAL'}, {u'text': u'Aulterra', u'type': u'GPE'}, {u'text': u'U0001f64f', u'type': u'ORG'}]",58485
51732814,"Magnetic food. Test the food first Join our telegram group, 18000  all against NWO, vaccines, 5G and so forth: https://t.me/nocovidvaccines Learn more on how to protect yourself  from 5G, 4G and EMFs here:  https://dq271.isrefer.com/go/Neuts/AUL651/ Share and subscribe","[{u'text': u'first', u'type': u'ORDINAL'}, {u'text': u'18000', u'type': u'CARDINAL'}, {u'text': u'NWO', u'type': u'ORG'}, {u'text': u'5', u'type': u'CARDINAL'}, {u'text': u'5', u'type': u'CARDINAL'}, {u'text': u'4', u'type': u'CARDINAL'}]",135830
51747524,"Masks no longer required in Israel in schools. Join our telegram group, 18000  all against NWO, vaccines, 5G and so forth: https://t.me/nocovidvaccines Learn more on how to protect yourself  from 5G, 4G and EMFs here:  https://dq271.isrefer.com/go/Neuts/AUL651/ Share and subscribe","[{u'text': u'Israel', u'type': u'GPE'}, {u'text': u'18000', u'type': u'CARDINAL'}, {u'text': u'NWO', u'type': u'ORG'}, {u'text': u'5', u'type': u'CARDINAL'}, {u'text': u'5', u'type': u'CARDINAL'}, {u'text': u'4', u'type': u'CARDINAL'}]",58485
51767263,"Phone sticks to baby because of the covid vaccine. Protect yourself from Emfs and read the science behind it, click here for more info: https://dq271.isrefer.com/go/HOUSEUSB/AUL862/  Join our telegram group, 16000 members all against NWO, vaccines, 5G and so forth: https://t.me/nocovidvaccines","[{u'text': u'Emfs', u'type': u'PERSON'}, {u'text': u'https://dq271.isrefer.com/go/HOUSEUSB/AUL862/', u'type': u'CARDINAL'}, {u'text': u'16000', u'type': u'CARDINAL'}, {u'text': u'NWO', u'type': u'ORG'}, {u'text': u'5', u'type': u'CARDINAL'}]",135783
51787076,"Everyone should start looking into 5G frequency blockers.  They have some to keep the towers from hitting into your home and for your body as well   We all know that 5G affects your health and mood to the unvaccinated and those that were vaccinated are extremely susceptible to being traced and controlled by nano Particles.  Stay healthy keep safe.  Why has the CDC always had A zombie Apocalypse survival guide?  Why did they broadcast on the news 2 weeks ago the worst locations to survive a Zombie Apocalypse?  Interesting fact here:  The amount of days between both shots is 28 days.  ""28 days later""  Deep State has always shown us through Hollywood what their plans are.","[{u'text': u'5', u'type': u'CARDINAL'}, {u'text': u'5', u'type': u'CARDINAL'}, {u'text': u'CDC', u'type': u'ORG'}, {u'text': u'the news 2 weeks ago', u'type': u'DATE'}, {u'text': u'a Zombie Apocalypse', u'type': u'WORK_OF_ART'}, {u'text': u'days', u'type': u'DATE'}, {u'text': u'28 days', u'type': u'DATE'}, {u'text': u'28 days later', u'type': u'DATE'}, {u'text': u'Deep State', u'type': u'WORK_OF_ART'}, {u'text': u'Hollywood', u'type': u'GPE'}]",58485
51787313,I just got a medallion from Godzwow.com you have check it out!! It does stop 5G and many other things. I just got mine. It has Gods frequency. You will not be disappointed 💕🌈💕,"[{u'text': u'Godzwow.com', u'type': u'PERSON'}]",58485
51787557,The difference between us and other countries is our president djt ordered all the CCP 5G removed from our cell towers right after he took office. He also outlawef CCP drones that some local leaders were using to spy on citizens.,"[{u'text': u'CCP', u'type': u'ORG'}, {u'text': u'CCP', u'type': u'ORG'}]",58485
51788630,Agreed. Now Verizon is getting desperate to recruit people with free phones with 5G . Soon others will as well. They are all in on it.,"[{u'text': u'Verizon', u'type': u'LOC'}, {u'text': u'5', u'type': u'CARDINAL'}]",58485
51788771,We got intel that its still 4G and they rebranded 5G because we knew 4G didn't have to be on towers and extremely close to us. They also held back a percentage of the strength and then released it as 5G to look stronger. We are also paying extra for this technology that isn't available and they wanted the frequencies closer.  I will try to find more info on this,"[{u'text': u'4', u'type': u'CARDINAL'}, {u'text': u'5', u'type': u'CARDINAL'}]",58485
51788905,What is the best way to protect my home and the body's in my home from the 5G? Please anybody have any ideas what I should do please let me know. Thank you and God bless much love and be safe to all,"[{u'text': u'5', u'type': u'CARDINAL'}]",58485
51789003,"Thank you Vicki Goatcher, what about 5G phones tablets laptops Etc?","[{u'text': u'Vicki Goatcher', u'type': u'PERSON'}, {u'text': u'about 5', u'type': u'CARDINAL'}]",58485
51789049,I saw a video where the 5G phones are empty.  Look it up.,"[{u'text': u'5', u'type': u'CARDINAL'}]",58485
51789125,Yea! That is why we don't have 5G,"[{u'text': u'5', u'type': u'CARDINAL'}]",58485
51789198,Trump tried to but it went into the biden administration. It just came out a few weeks ago that the Pentagon is using CCP drones so I don't believe that we are safe from 5G but maybe Space Force has something but regardless we need to have something to protect ourselves,"[{u'text': u'a few weeks ago', u'type': u'DATE'}, {u'text': u'Pentagon', u'type': u'ORG'}, {u'text': u'CCP', u'type': u'ORG'}, {u'text': u'5', u'type': u'CARDINAL'}, {u'text': u'Space Force', u'type': u'ORG'}]",58485
51789234,Put it this way If we were safe from 5G there would be no reported deaths from the vaccine because a spike protein and the nanoparticles,"[{u'text': u'5', u'type': u'CARDINAL'}]",58485
51790329,I will try to find the post and forward but there is info on Telegram that Elon Musk is changing the 5G towers to Tesla to protect us. Makes sense.,"[{u'text': u'Telegram', u'type': u'ORG'}, {u'text': u'5', u'type': u'CARDINAL'}]",58485
51811399,"Phone sticks to baby because of the covid vaccine. Protect yourself from Emfs and read the science behind it, click here for more info: https://dq271.isrefer.com/go/HOUSEUSB/AUL1691/  Join our telegram group, 16000 members all against NWO, vaccines, 5G and so forth: https://t.me/nocovidvaccines","[{u'text': u'Emfs', u'type': u'PERSON'}, {u'text': u'16000', u'type': u'CARDINAL'}, {u'text': u'NWO', u'type': u'ORG'}, {u'text': u'5', u'type': u'CARDINAL'}]",11865
51812087,This is not a tree.  This is a 5G tower.,"[{u'text': u'5', u'type': u'CARDINAL'}]",135764
51820201,"I saw the video too of a phone repair guy showing on two phones where the 5G chip should be in the phones and they weren.t there. Does that mean no phone have it? Not necessarily. Also, I read in more than one post that 5G is to zap people who got the vax by jab or shedding. Right???","[{u'text': u'two', u'type': u'CARDINAL'}, {u'text': u'5', u'type': u'CARDINAL'}, {u'text': u'more than one', u'type': u'CARDINAL'}, {u'text': u'5', u'type': u'CARDINAL'}]",58485
51890823,right after President Trump took office he ordered all the CCP 5G removed from our cell towers,"[{u'text': u'Trump', u'type': u'PERSON'}, {u'text': u'CCP', u'type': u'ORG'}]",58485
51914297,"Body Align- I bought 3 times from this Co. They explain about 5G, and how their Holograms cut the frequencies by way more than half. 👍  https://bodyalign.com/?utm_campaign=May%20C4%20-%20Memorial%20Day%20-%20BA%20%28UMQ4X9%29&utm_medium=email&utm_source=All%20Contacts&_ke=eyJrbF9jb21wYW55X2lkIjogIk5DbXgzMiIsICJrbF9lbWFpbCI6ICJkZXNlcnQxMHJvc2VAZ21haWwuY29tIn0%3D","[{u'text': u'3', u'type': u'CARDINAL'}, {u'text': u'about 5', u'type': u'CARDINAL'}, {u'text': u'Holograms', u'type': u'GPE'}, {u'text': u'more than half', u'type': u'CARDINAL'}]",58485
51948692,This is what 5G can do to you,[],58485
51950872,"I have a different view.  I totally hope you're right!  Buy I don't believe you are.  My husband and I bought our home almost two years ago.  A 5G was put on the tower half a mile away a year after we moved here.  And, I read about a CCP drone, which couldn't be detected, outside a base in AZ using thermal imaging.    There's so much disinformation out there so I may be wrong about the drone, but I'm not wrong about the tower.  We may move if the tower isn't dealt with after our President publicly returns.","[{u'text': u'almost two years ago', u'type': u'DATE'}, {u'text': u'5', u'type': u'CARDINAL'}, {u'text': u'half a mile', u'type': u'QUANTITY'}, {u'text': u'CCP', u'type': u'ORG'}, {u'text': u'AZ', u'type': u'ORG'}]",58485
51978301,"Magnetic food. Test the food first Join our telegram group, 18000  all against NWO, vaccines, 5G and so forth:  Learn more on how to protect yourself  from 5G, 4G and EMFs here:  Share and subscribe  ⚜️Join Q+anons Chatroom⚜️         👇    35K members!   👇    👁@Q_anon_donaldtrump👁  Subscribe Team Trump 👇👇 @originalDONALDTRUMP","[{u'text': u'first', u'type': u'ORDINAL'}, {u'text': u'18000', u'type': u'CARDINAL'}, {u'text': u'NWO', u'type': u'ORG'}, {u'text': u'5', u'type': u'CARDINAL'}, {u'text': u'5', u'type': u'CARDINAL'}, {u'text': u'4', u'type': u'CARDINAL'}, {u'text': u'Q+anons Chatroom', u'type': u'ORG'}, {u'text': u'U0001f441', u'type': u'ORG'}, {u'text': u'U0001f441nnSubscribe Team Trump', u'type': u'ORG'}]",58485
51979238,"Did you know ?  Studies Prove Cell Phone Radiation Causes Damage to DNA. Latest studies confirm what cellular phone corporations do not want you to know. Even casual use of cell phones can cause damage to your DNA in sensitive areas of the brain. A landmark study conducted by Dr. Henry Lai of the University of Washington showed that even at low levels, exposure to radio frequency electromagnetic fields and radio frequencies (EMF/RF) caused DNA damage to brain cells of rats, resulting in loss of short and long-term memory and slower learning. He further noted: “DNA damages in cells could have an important implication on health because they are cumulative.” A study done at Penn State University concluded that EMF exposure produced no effect for the “first few minutes, . . . then a cascade of microbial destruction occurs.”  Aulterra devices give protection against 5G and wifi, which has become vital for our health. They can be found at this link:   [https://dq271.isrefer.com/go/5GEMF/AUL1950/](https://dq271.isrefer.com/go/5GEMF/AUL1950/)  *Please Share !!!❤️","[{u'text': u'Henry Lai', u'type': u'PERSON'}, {u'text': u'the University of Washington', u'type': u'ORG'}, {u'text': u'EMF/RF', u'type': u'ORG'}, {u'text': u'Penn State University', u'type': u'ORG'}, {u'text': u'EMF', u'type': u'ORG'}, {u'text': u'the u201cfirst few minutes', u'type': u'DATE'}, {u'text': u'5', u'type': u'CARDINAL'}]",58485
