id,content,named_entities,channel
44411128,"WHY WUHAN?  The Nikkei says it strikes at the heart of “Made In China 2025”   Julie Ball, a former resident of Wuhan, helps us connect the dots. No, there is no smoking gun. Just food for thought.... 🤔😎  Julie Ball: || There's a lot more to this US battle with Huawei than cell phones. It has to do with warfare, Charles Lieber...and also Wuhan. Wuhan? Yes, Wuhan. But not in the way some Youtubers may think...  OK, people might wonder why I say the US military industrial complex and the neocons are freaking out about 5G and cell phones. It's more than just cell phones. The technology that China is working on will, in the view of the US DoD, change the nature of warfare forever. It's a big flipping deal.  According to a White House Defense industry report, ""Another concern are China’s advances in “foundational dual-use industries such as semiconductors, chip materials, robotics, aviation and satellites,” the report says. As technical innovation moves abroad, “changing rules around intellectual property development will impede U.S. access to the latest manufacturing technologies.” At risk is America’s loss of leadership in industries of the future such as artificial intelligence, quantum computing and robotics, the report notes. “Over the remainder of this century, these emerging industries will help redefine the BATTLEFIELD.”   Charles Lieber, chair of Harvard's department of chemistry and member of the China's Thousand Talents Program. who was doing research with the Wuhan University of Technology didn't get unjustly arrested for nothing. They say he was covering up ties to China. How ridiculous! His name was probably listed on the Thousand Talents website. FBI doesn't have the internet, or what?  For working with the Thousand Talents Program  and developing nano-batteries and nano-tech. with the University of Technology in Wuhan (NOT the University of Virology as some have been saying on Youtube), which is the pilot city for the ""Made in China 2025"" The same initiative that the US Sec of Defense freaked out about to the Armed Services Committee. Oh that's funny.. Wuhan, did you say? I heard about something going on there recently in the news. Yes Wuhan.   In 2016, the Chinese designated Wuhan as the model city for the roll out of the digital Silk Road and AI and 5G and the Made in China2025 Initiative. China’s Ministry of Industry and Information Technology to give Wuhan all priority for all resources, projects and programs. This is a big threat to the US military-industrial complex. So Wuhan keeps coming up, doesn't it?  This is a technological arms race and the US is losing. So, they are resorting to a lot of dirty tricks. A lot of them. I'm not making connections. I'm saying the US was not happy about Wuhan.  https://www.facebook.com/groups/947867908642430/permalink/2751178531644683/ ||  Julie Ball: || Why would the US want to target Wuhan? This is why and it aint about cellphones. They see the 5g research and rollout in Wuhan as..... and I quote, 'a national security threat' and 'we must act aggressively'. Wuhan, the capital city of central China’s Hubei Province, was approved by China’s Ministry of Industry and Information Technology as a pilot city for the ""Made in China 2025"" plan, said Wuhan Commission for Economics and Information Technology on December 8, 2016.  In March of 2019, acting defense secretary Patrick Shanahan noted a number of Chinese government initiatives that seek to enhance Chinese influence globally.  He said. “With initiatives like the Digital Silk Road, Made in China 2025 and Thousand Talents Program in play, which spur companies and individuals to carry out its bidding, China aims to steal its way to a China-controlled global technological infrastructure, including a 5G network,” he told the Senate Armed Services Committee.""  This a technological arms race.  Before you call me a 'conspiracy theorist', I said 'why would they want to', not 'why did they'.","[{u'text': u'WUHAN', u'type': u'ORG'}, {u'text': u'Made In China 2025', u'type': u'WORK_OF_ART'}, {u'text': u'Julie Ball', u'type': u'PERSON'}, {u'text': u'Wuhan', u'type': u'GPE'}, {u'text': u'U0001f914', u'type': u'CARDINAL'}, {u'text': u'Julie Ball', u'type': u'PERSON'}, {u'text': u'US', u'type': u'GPE'}, {u'text': u'Huawei', u'type': u'ORG'}, {u'text': u'Charles Lieber', u'type': u'PERSON'}, {u'text': u'Wuhan', u'type': u'GPE'}, {u'text': u'Wuhan', u'type': u'GPE'}, {u'text': u'Wuhan', u'type': u'GPE'}, {u'text': u'Youtubers', u'type': u'PERSON'}, {u'text': u'US', u'type': u'GPE'}, {u'text': u'about 5', u'type': u'CARDINAL'}, {u'text': u'China', u'type': u'GPE'}, {u'text': u'US', u'type': u'GPE'}, {u'text': u'White House', u'type': u'ORG'}, {u'text': u'China', u'type': u'GPE'}, {u'text': u'U.S.', u'type': u'GPE'}, {u'text': u'America', u'type': u'GPE'}, {u'text': u'quantum', u'type': u'ORG'}, {u'text': u'this century', u'type': u'DATE'}, {u'text': u'Charles Lieber', u'type': u'PERSON'}, {u'text': u'Harvard', u'type': u'ORG'}, {u'text': u'China', u'type': u'GPE'}, {u'text': u'Thousand Talents Program', u'type': u'ORG'}, {u'text': u'the Wuhan University of Technology', u'type': u'ORG'}, {u'text': u'China', u'type': u'GPE'}, {u'text': u'Thousand Talents', u'type': u'ORG'}, {u'text': u'FBI', u'type': u'ORG'}, {u'text': u'the Thousand Talents Program', u'type': u'ORG'}, {u'text': u'the University of Technology', u'type': u'ORG'}, {u'text': u'Wuhan', u'type': u'GPE'}, {u'text': u'the University of Virology', u'type': u'ORG'}, {u'text': u'Youtube', u'type': u'PERSON'}, {u'text': u'China', u'type': u'GPE'}, {u'text': u'2025', u'type': u'DATE'}, {u'text': u'the US Sec of Defense', u'type': u'ORG'}, {u'text': u'the Armed Services Committee', u'type': u'ORG'}, {u'text': u'Wuhan', u'type': u'GPE'}, {u'text': u'Wuhan', u'type': u'GPE'}, {u'text': u'2016', u'type': u'DATE'}, {u'text': u'Chinese', u'type': u'NORP'}, {u'text': u'Wuhan', u'type': u'GPE'}, {u'text': u'Silk Road', u'type': u'FAC'}, {u'text': u'AI', u'type': u'GPE'}, {u'text': u'5', u'type': u'CARDINAL'}, {u'text': u'Chinau2019s Ministry of Industry and Information Technology', u'type': u'ORG'}, {u'text': u'Wuhan', u'type': u'GPE'}, {u'text': u'US', u'type': u'GPE'}, {u'text': u'Wuhan', u'type': u'GPE'}, {u'text': u'US', u'type': u'GPE'}, {u'text': u'US', u'type': u'GPE'}, {u'text': u'Wuhan', u'type': u'GPE'}, {u'text': u'https://www.facebook.com/groups/947867908642430/permalink/2751178531644683/', u'type': u'ORG'}, {u'text': u'Julie Ball', u'type': u'PERSON'}, {u'text': u'US', u'type': u'GPE'}, {u'text': u'Wuhan', u'type': u'GPE'}, {u'text': u'5', u'type': u'CARDINAL'}, {u'text': u'Wuhan', u'type': u'GPE'}, {u'text': u'Wuhan', u'type': u'GPE'}, {u'text': u'China', u'type': u'GPE'}, {u'text': u'Hubei Province', u'type': u'GPE'}, {u'text': u'Chinau2019s Ministry of Industry and Information Technology', u'type': u'ORG'}, {u'text': u'China', u'type': u'GPE'}, {u'text': u'Wuhan Commission for Economics and Information Technology', u'type': u'ORG'}, {u'text': u'December 8, 2016', u'type': u'DATE'}, {u'text': u'March of 2019', u'type': u'DATE'}, {u'text': u'Patrick Shanahan', u'type': u'PERSON'}, {u'text': u'Chinese', u'type': u'NORP'}, {u'text': u'Chinese', u'type': u'NORP'}, {u'text': u'the Digital Silk Road', u'type': u'ORG'}, {u'text': u'China', u'type': u'GPE'}, {u'text': u'2025', u'type': u'DATE'}, {u'text': u'Thousand Talents Program', u'type': u'ORG'}, {u'text': u'China', u'type': u'GPE'}, {u'text': u'China', u'type': u'GPE'}, {u'text': u'5', u'type': u'CARDINAL'}, {u'text': u'the Senate Armed Services Committee', u'type': u'ORG'}]",36003
44411363,is 5 G involved     5G is military grade weapon,"[{u'text': u'5', u'type': u'CARDINAL'}, {u'text': u'5', u'type': u'CARDINAL'}]",36003
44416970,I mean you should of seen all the 5G / Coronavirus nonsense,"[{u'text': u'5', u'type': u'CARDINAL'}]",36003
44423733,Tesla lived to be 86 and he did crazy shit in his lab. Lived to be 86 and these morons are worried about 5G,"[{u'text': u'about 5', u'type': u'CARDINAL'}]",36003
44424038,https://youtu.be/IyReGsUVlGU invidio.us/IyReGsUVlGU (Zum Thema 5G/Huawai),"[{u'text': u'Zum Thema', u'type': u'PERSON'}]",53624
44424058,"Exactly, I am so fucking tired of people posting that dumb ladies video about it being 5G and you need to not worry about the virus at all. That is the dumbest miss information and will get people fucking killed",[],36003
44426156,"We understand the 5G & COVID-19 connection might be hard to grasp for some people.  This video is a great entry point for research and explains the most important points:  https://www.youtube.com/watch?v=CtfqUtW_8AA  WE CONSIDER THIS A MUST WATCH FOR EVERYONE!  This information is by far the most important COVID-19 intel we have ever shared through this telegram channel. We have checked the material and deem it absolutely worthy to be brought to a greater audience, even though it is a very controversial claim. We urge everybody to investigate and research the claim that 5G cellular network can be responsible for COVID-19 symptoms.  #5GcausesCOVID19  @COVID19update","[{u'text': u'5', u'type': u'CARDINAL'}, {u'text': u'G & COVID-19', u'type': u'ORG'}, {u'text': u'5', u'type': u'CARDINAL'}, {u'text': u'5GcausesCOVID19', u'type': u'MONEY'}]",36003
44426157,"5G IN CHINA IN REGARDS TO COVID-19  Wuhan was one of the first 5G cities in China (even the world), which is now fully equipped with 5G in the final stage. Over 30,000 transmission masts pave the whole city. https://archive.is/TMK6c  China turned on its 5G networks in late November, around the time Coronavirus started to break out. https://archive.is/ZV5s2  5G base stations set up in Wuhan Vulcan Mountain Hospital, the 'famous' Coronavirus makeshift hospital that china built. https://archive.is/A0VwV  More than 30 hospitals and China Association of Medical Equipment (CAME) have joined forces with China Telecom, China Mobile, China Unicom, and Huawei to establish China's first 5G Hospital Network Standard. https://archive.is/t9uD4  #5GcausesCOVID19  @COVID19update","[{u'text': u'5', u'type': u'CARDINAL'}, {u'text': u'Wuhan', u'type': u'GPE'}, {u'text': u'one', u'type': u'CARDINAL'}, {u'text': u'first', u'type': u'ORDINAL'}, {u'text': u'5', u'type': u'CARDINAL'}, {u'text': u'China', u'type': u'GPE'}, {u'text': u'5', u'type': u'CARDINAL'}, {u'text': u'30,000', u'type': u'CARDINAL'}, {u'text': u'China', u'type': u'GPE'}, {u'text': u'5', u'type': u'CARDINAL'}, {u'text': u'late November', u'type': u'DATE'}, {u'text': u'Coronavirus', u'type': u'ORG'}, {u'text': u'5', u'type': u'CARDINAL'}, {u'text': u'Wuhan', u'type': u'GPE'}, {u'text': u'china', u'type': u'GPE'}, {u'text': u'More than 30', u'type': u'CARDINAL'}, {u'text': u'China Association of Medical Equipment (CAME', u'type': u'ORG'}, {u'text': u'China Telecom', u'type': u'ORG'}, {u'text': u'China Mobile', u'type': u'ORG'}, {u'text': u'China', u'type': u'GPE'}, {u'text': u'Huawei', u'type': u'ORG'}, {u'text': u'China', u'type': u'GPE'}, {u'text': u'first', u'type': u'ORDINAL'}, {u'text': u'G Hospital Network Standard', u'type': u'ORG'}, {u'text': u'5GcausesCOVID19', u'type': u'MONEY'}]",36003
44426158,"5G responsible for COVID-19 symptoms?  WE CONSIDER THIS A MUST READ FOR EVERYONE!  https://boards.4chan.org/pol/thread/245555823  >Exposure to 5G in the relevant frequency range impairs your bloods ability to uptake and transport oxygen. Specifically it prohibits your hemoglobin from binding with oxygen molecules. The human body responds to the resulting insufficient supply of oxygen with flu and viral like symptoms such as shortness of breath, dry cough and others. The lack of oxygen supply further culminates in Acute Respiratory Distress Syndrome, Arrhythmia, and Acute Cardiac Injury and/or Acute Kidney Injury.  >The symptoms that can be related to 5G do match the reports coming from Wuhan hospitals and social media, specifically numerous reports of dry cough without phlegm, which is unusual for natural pneumonia.  You will need some time to work through this as there is a lot of material presented. It is however absolutely compelling. This MUST be investigated!  This information is by far the most important COVID-19 intel we have ever shared through this telegram channel. We have checked the material and deem it absolutely worthy to be brought to a greater audience, even though it is a very controversial claim. We urge everybody to investigate and research the claim that 5G cellular network can be responsible for COVID-19 symptoms.  #5GcausesCOVID19  @COVID19update","[{u'text': u'5', u'type': u'CARDINAL'}, {u'text': u'5', u'type': u'CARDINAL'}, {u'text': u'Acute Respiratory Distress Syndrome', u'type': u'ORG'}, {u'text': u'Arrhythmia', u'type': u'ORG'}, {u'text': u'Acute Cardiac Injury', u'type': u'ORG'}, {u'text': u'Acute Kidney Injury', u'type': u'PERSON'}, {u'text': u'5', u'type': u'CARDINAL'}, {u'text': u'Wuhan', u'type': u'GPE'}, {u'text': u'5', u'type': u'CARDINAL'}, {u'text': u'5GcausesCOVID19', u'type': u'MONEY'}]",36003
44426163,Tesla did a bunch of crazy experiments way crazier than 5G,"[{u'text': u'5', u'type': u'CARDINAL'}]",36003
44426167,The public is about to get 5G but the military industrial complex has had it for a while,[],36003
44427076,No 5G had nothing to do with it,[],36003
44427153,Stop w this 5G crap . It’s bad for you. And it’s totally not related!,"[{u'text': u'5', u'type': u'CARDINAL'}]",36003
44427204,I just went down the 5G rabbit hole for 5 minutes and all I have to say is that shit is so dumb. Like actually dumb. Like Coronavirus isn’t real and it’s 5G. GTFOH.,"[{u'text': u'5', u'type': u'CARDINAL'}, {u'text': u'5 minutes', u'type': u'TIME'}, {u'text': u'Coronavirus', u'type': u'ORG'}]",36003
44427205,No these idiots are saying there is no virus and it’s really just 5G causing a lack of oxygen. Like actual idiots,"[{u'text': u'5', u'type': u'CARDINAL'}]",36003
44427206,Like I can believe 5G has health issues but a conspiracy theory that says there is no virus because pneumonia isn’t a dry cough and therefore it must be 5G is like wtaf how dumb are you,[],36003
44427210,I don’t buy into that. I do think 5G can and will be used in other ways. It was not initially developed for cellular but for military use. I think there are some legitimate worries about it being used as a weapon.,[],36003
44427217,I’m not debating that 5G is bad. I’m saying it’s definitely not NOT an actual virus. Like come on,[],36003
44427777,Like the 5G crap 🤮,"[{u'text': u'5', u'type': u'CARDINAL'}]",36003
44428618,It’s not 5G lol,"[{u'text': u'5', u'type': u'CARDINAL'}]",36003
44428625,Haha I know it’s not 5G Aries :),"[{u'text': u'5', u'type': u'CARDINAL'}]",36003
44428864,Personally I think people who even bring up 5G here should be kicked out of the group. But hey. That’s just me. Aries is the boss,"[{u'text': u'5', u'type': u'CARDINAL'}]",36003
44428868,"Perri chill a bit, @Woken77 was just asking an opinion regarding 5G no need to say you would kick them out.","[{u'text': u'Perri', u'type': u'PERSON'}, {u'text': u'5', u'type': u'CARDINAL'}]",36003
44433892,Sheep-ery abounds and the 5G and Nano stuff gets me angry now,"[{u'text': u'5', u'type': u'CARDINAL'}, {u'text': u'Nano', u'type': u'PERSON'}]",36003
44439396,"It would appear theres data you do not have yet, as there’s many types of “frequencies” that are effective for healing, or can be cellularly protective, or beneficial for a variety of things. That topic-conversation was exploring the other end of the spectrum with frequency, it definitely had nothing to do with 5G, which is millimeter wave technology.","[{u'text': u'5', u'type': u'CARDINAL'}]",36003
44442577,"""Take a look at “Before It’s News,” a conspiracy website that mainly links to videos. The last few days, they have specialized in making five or six or more entirely contradictory claims about Corona virus; for example that it is a plot of the Queen of England and the Rothschilds, that it is a fake to cover the sickness and death caused by 5G phones, the New World Order started Corona Virus to kill 5 billion people, or that the whole thing is a gigantic fraud to make money for pharmaceutical companies. These are all on their website at the same time- just pick your favorite. "" www.befofenews.com do You familiar earlier with this page? Know something about this page?","[{u'text': u'Before Itu2019s News', u'type': u'WORK_OF_ART'}, {u'text': u'The last few days', u'type': u'DATE'}, {u'text': u'five or', u'type': u'DATE'}, {u'text': u'Corona', u'type': u'ORG'}, {u'text': u'the Queen of England', u'type': u'ORG'}, {u'text': u'Rothschilds', u'type': u'PERSON'}, {u'text': u'5', u'type': u'CARDINAL'}, {u'text': u'the New World Order', u'type': u'ORG'}, {u'text': u'Corona Virus', u'type': u'PERSON'}, {u'text': u'5 billion', u'type': u'CARDINAL'}]",36003
44489624,Guys look 5G is old technology,[],36003
44489625,I ban it because there is no link to Coronavirus and 5G,"[{u'text': u'Coronavirus', u'type': u'ORG'}, {u'text': u'5', u'type': u'CARDINAL'}]",36003
44491075,If 5G brings me closer to a PlayStation 9 I’m all for it https://youtu.be/IyPQVsdCuRk,"[{u'text': u'5', u'type': u'CARDINAL'}, {u'text': u'PlayStation 9', u'type': u'PRODUCT'}]",36003
44491922,It's clearly not 5G,"[{u'text': u'5', u'type': u'CARDINAL'}]",36003
44492055,"MORONS!!! 🇮🇱 Israel: Protest currently at Rabin Square in Tel Aviv against 5G  It should be noted that Israel does not have 5G, but does have over 10,000 coronavirus cases.","[{u'text': u'U0001f1ee', u'type': u'PERSON'}, {u'text': u'Israel', u'type': u'GPE'}, {u'text': u'Rabin Square', u'type': u'FAC'}, {u'text': u'Tel Aviv', u'type': u'GPE'}, {u'text': u'5', u'type': u'CARDINAL'}, {u'text': u'Israel', u'type': u'GPE'}, {u'text': u'5', u'type': u'CARDINAL'}, {u'text': u'10,000', u'type': u'CARDINAL'}]",36003
44492421,"My mask helps prevent 5G covid issues by preventing you from talking about your conspiracy theory.  Stay protected from corona and BS 5G conspiracies, wear a mask","[{u'text': u'5', u'type': u'CARDINAL'}, {u'text': u'5', u'type': u'CARDINAL'}]",36003
44495255,"I just don't see how 5G can work effectively but that's different topic. I'd rather have 10 Gigabit Ethernet everywhere, I'm doing like 800 megs a second that way","[{u'text': u'5', u'type': u'CARDINAL'}, {u'text': u'10', u'type': u'CARDINAL'}, {u'text': u'second', u'type': u'ORDINAL'}]",36003
44496106,Cell Phone RADIATION & 5G DANGERS - An In-Depth Exploration,[],135827
44496357,Just a friendly admin reminder that all 5G talk is verboten. Unless it's these 5 G's,"[{u'text': u'5', u'type': u'CARDINAL'}, {u'text': u'5', u'type': u'CARDINAL'}]",36003
44496728,Because Alex if you continue this then the 5G crowd comes out etc etc,"[{u'text': u'5', u'type': u'CARDINAL'}]",36003
44496751,All I care about is producing Actionable Intelligence not trolling and conspiracies or 5G or Bill Gates none of that noise will keep you ahead of the curve,"[{u'text': u'5', u'type': u'CARDINAL'}, {u'text': u'Bill Gates', u'type': u'PERSON'}]",36003
44497449,What 5Gtards sound like to me ⬆️⬆️⬆️,[],36003
44497460,I don't like 5G either and there's lots of papers that show it's bad but not understanding we are dealing with a bioweapon and blaming 5G for the virus is just making things worse,"[{u'text': u'5', u'type': u'CARDINAL'}]",36003
44498818,"The U.K. announced in January that it would allow Huawei to build part of its 5G mobile network against U.S. warnings that the tech giant poses a security risk.  POMPEO: NATIONS SHOULD RETHINK USE OF HUAWEI AMID CORONAVIRUS  ""I think this has been a real moment for business leaders all across America to see the political risk associated with the operations inside of China,"" Pompeo said.  He also said the U.S. supply chain shouldn't be dependent on any other country.","[{u'text': u'U.K.', u'type': u'GPE'}, {u'text': u'January', u'type': u'DATE'}, {u'text': u'Huawei', u'type': u'ORG'}, {u'text': u'5', u'type': u'CARDINAL'}, {u'text': u'U.S.', u'type': u'GPE'}, {u'text': u'America', u'type': u'GPE'}, {u'text': u'China', u'type': u'GPE'}, {u'text': u'Pompeo', u'type': u'PERSON'}, {u'text': u'U.S.', u'type': u'GPE'}]",36003
44500035,"During the week, 53 5G network masts were attacked in the UK. https://www.businessinsider.com/attacks-cellphone-towers-coronavirus-5g-conspiracy-2020-4  British mobile operator EE said conspiracy theorists pose a “risk to human life” by setting fire to telecommunications masts. During Easter weekend alone, 22 EE telephone masts were burned. https://inews.co.uk/news/coronavirus-lockdown-latest-5g-conspiracy-theories-ee-phone-masts-easter-2538429  The attack also damaged the Vodafone mast, serving the Chelmsley wood hospital in Birmingham. https://www.thesun.co.uk/tech/11400110/5g-coronavirus-conspiracy-theory-arson-attack-nightingale-hospital-vodafone-birmingham/  Homes in Huddersfield were also evacuated early on Tuesday morning after a mast attached to the Fearnleys Mill home development was set on fire, destroying equipment belonging to three network providers.  Another mast in Birmingham, which provided mobile connectivity to the city's recently-erected Nightingale Hospital, was also attacked over the weekend.  The vast majority of the phone masts were not carrying 5G equipment, meaning 2G, 3G and 4G network infrastructure essential to emergency services  during the outbreak was affected.","[{u'text': u'the week', u'type': u'DATE'}, {u'text': u'53 5', u'type': u'CARDINAL'}, {u'text': u'UK', u'type': u'GPE'}, {u'text': u'British', u'type': u'NORP'}, {u'text': u'Easter weekend', u'type': u'DATE'}, {u'text': u'22', u'type': u'CARDINAL'}, {u'text': u'Vodafone', u'type': u'ORG'}, {u'text': u'Chelmsley', u'type': u'LOC'}, {u'text': u'Birmingham', u'type': u'GPE'}, {u'text': u'Huddersfield', u'type': u'ORG'}, {u'text': u'Tuesday', u'type': u'DATE'}, {u'text': u'morning', u'type': u'TIME'}, {u'text': u'Fearnleys Mill', u'type': u'PRODUCT'}, {u'text': u'three', u'type': u'CARDINAL'}, {u'text': u'Birmingham', u'type': u'GPE'}, {u'text': u'Nightingale Hospital', u'type': u'ORG'}, {u'text': u'the weekend', u'type': u'DATE'}, {u'text': u'5', u'type': u'CARDINAL'}, {u'text': u'2', u'type': u'CARDINAL'}, {u'text': u'3', u'type': u'CARDINAL'}, {u'text': u'4', u'type': u'CARDINAL'}]",36003
44501099,Now this 5G is gonna get shilled and ps*op'd to death and no one's going to achieve anything and everyone's gonna have a big nasty antenna in their backyard so the glowies can have a 3D scan of everyone jerking off,"[{u'text': u'5', u'type': u'CARDINAL'}]",135827
44507654,and 5G,"[{u'text': u'5', u'type': u'CARDINAL'}]",36003
44511674,"Well if solar flares etc influence viruses, then maybe the 5G people are right? I’m not a fan of 5G = Covid, but reading these papers about solar influence makes me think they also have a point. 🤔","[{u'text': u'5', u'type': u'CARDINAL'}, {u'text': u'5', u'type': u'CARDINAL'}, {u'text': u'Covid', u'type': u'PERSON'}, {u'text': u'U0001f914', u'type': u'CARDINAL'}]",36003
44511685,well if you into the theory about the connection between 5G somewhat relevant to this pandemic then you should watch this MD view point: https://www.youtube.com/watch?v=APaUEgfeAYE,"[{u'text': u'MD', u'type': u'GPE'}, {u'text': u'https://www.youtube.com/watch?v=APaUEgfeAYE', u'type': u'WORK_OF_ART'}]",36003
44511686,We tend to be a no 5G group,[],36003
44511688,"well he not into 5G anyway, he just point out that this pandemic is not really what we are seeing","[{u'text': u'5', u'type': u'CARDINAL'}]",36003
44512818,"Few days ago, the world's tallest 5G tower was installed on Mount Everest using yaks to transport equipment.","[{u'text': u'Few days ago', u'type': u'DATE'}, {u'text': u'5', u'type': u'CARDINAL'}, {u'text': u'Mount Everest', u'type': u'LOC'}]",36003
44514843,Can 5G replace GPS in the future? Starlink satelites? https://www.fastcompany.com/90314058/5g-means-youll-have-to-say-goodbye-to-your-location-privacy,"[{u'text': u'5', u'type': u'CARDINAL'}]",36003
44514909,https://t.me/DoomsdayDisclosure 5G / Gates Foundation / Go 😜 Wild,"[{u'text': u'5', u'type': u'CARDINAL'}, {u'text': u'G / Gates Foundation', u'type': u'ORG'}, {u'text': u'U0001f61c', u'type': u'CARDINAL'}]",36003
44515452,https://t.me/DoomsdayDisclosure Invite anyone into 5G / Gates Foundation / Fringe / UFO / Off-World / Hyperdimensionals,"[{u'text': u'Invite', u'type': u'ORG'}, {u'text': u'5', u'type': u'CARDINAL'}, {u'text': u'G / Gates Foundation / Fringe / UFO / Off-World / Hyperdimensionals', u'type': u'ORG'}]",36003
44516073,"🇬🇧 Police have arrested 14 people for breaching lockdown restrictions after they took part in a protest opposing lockdown in London today.   During the demonstration at St James Park, they promoted conspiracy theories about coronavirus, relating to 5G and vaccinations.","[{u'text': u'U0001f1e7 Police', u'type': u'ORG'}, {u'text': u'14', u'type': u'CARDINAL'}, {u'text': u'London', u'type': u'GPE'}, {u'text': u'today', u'type': u'DATE'}, {u'text': u'St James Park', u'type': u'FAC'}, {u'text': u'5', u'type': u'CARDINAL'}]",36003
44516636,https://t.me/DoomsdayDisclosure 5G / Gates Foundation / Go 😜 Wild,"[{u'text': u'5', u'type': u'CARDINAL'}, {u'text': u'G / Gates Foundation', u'type': u'ORG'}, {u'text': u'U0001f61c', u'type': u'CARDINAL'}]",36003
